ID,Reported_Day,prod_cat,Country,Detailed_Description,Priority,Impact,Incident_Type,Reported_Source,Target
INC000014022237,3,prod_cat -2,Country-1,annual leave codes has assigned hi please close best regards analyst friday pm re annual leave codes has assigned hi reason believe added codes looking approve saw timecard error looking annual leave codes active selected image form prod today where has doubled his timecard annual leave requested absence inserted code thursday pm re annual leave codes has assigned hi annual leave were closed visible cards anymore best regards analyst thursday pm re annual leave codes has assigned hello closed thank wednesday pm re annual leave codes has assigned hi annual leave closed countries except created after went has date future by close well best regards analyst wednesday re annual leave codes has assigned hi please close codes were closed after then again after made corrections timecards opened again absences closed thank tuesday pm re annual leave codes has assigned hi far nothing done past cards these codes yet facing issues regarding lot close cases deal old cards close date best regards analyst tuesday pm annual leave codes has assigned please advised record number has assigned please review details take appropriate action description annual leave codes hi please best regards analyst tuesday pm annual leave codes hello work done timecards annual leave codes active logged done background work done think close back thank officer summary annual leave codes number priority moderate assignment location center please link attachments image image image image kind regards ref msg,Low,4-Minor,Incident_Type-1,Phone,Target-7
INC000014071494,4,prod_cat -1,Country-1,february dear colleagues going february starts starts starts starts forms attached great,Low,4-Minor,Incident_Type-1,Phone,Target-7
INC000014066989,3,prod_cat -3,Country-1,upload rights location pm hello please location pm area disciplines libraries pm disc cross sessions view ca ribbon thank,Low,4-Minor,Incident_Type-2,Phone,Target-7
INC000014040694,6,prod_cat -5,Country-1,creative titles hello update job titles senior designer senior designer designer visual designer visual designer designer senior visual designer visual designer visual designer visual designer head creative moment analyst analyst since split off discipline creating confusion calls thank head creative,Low,4-Minor,Incident_Type-2,Phone,Target-7
INC000014020254,3,prod_cat -1,Country-1,permanent hi way setup meeting permanent id client dedicated myself thanks ex regards,Low,4-Minor,Incident_Type-2,Phone,Target-7
INC000014016669,2,prod_cat -4,Country-1,create scheduled report hello please kind log help setting scheduled weekly report report highlighted everyone included highlighted agent tried creating path actual schedule agent whom well run tried actual report run agent by agent by make busy code were options none ones furthermore selecting out curiosity let submit thank much best regards leader,Low,4-Minor,Incident_Type-2,Phone,Target-7
INC000014024596,2,prod_cat -3,Country-1,hi change possible myself log thanks friday december pm re approved friday december pm dear owner kindly looking forward hearing thank kind regards analyst ext history reference history additional comments visible update task task assignment assignee owner closed complete work notes description hi please these persons change name more ref msg,Low,4-Minor,Incident_Type-2,Phone,Target-7
INC000013992330,5,prod_cat -2,Country-1,test hi please has user name seems he connect thank friday test hi today found he has test cases user name please help rights same thank thursday december accounts has assigned hi thank ask everything works thank wednesday december pm re accounts has assigned hi added same roles has same rights please everything works side questions hesitate best regards engineer wednesday december pm accounts has assigned please advised record number has assigned please review details take appropriate action description accounts hi thank providing seems he misses test cases module he same rights more details regards wednesday december pm accounts hi found enter he has please help rights same created by same thank wednesday december accounts hi status credentials received granted work credentials received cannot accessed without certificates received delayed join probably tomorrow wrote best regards wednesday december accounts hi please accesses working thank tuesday december pm accounts hi credentials sorry delay forwarding these details thank friday december accounts hello please advised ad accounts created display name display name assist please let best regards analyst ext hub summary accounts number priority moderate assignment location center please link attachments image image kind regards ref msg,Low,4-Minor,Incident_Type-2,Phone,Target-7
INC000013882238,3,prod_cat -1,Country-1,hello kindly asking help out amend personal filters visible snow multiple ones which anymore also add please explain exactly which ones keep add thank,Low,4-Minor,Incident_Type-2,Phone,Target-7
INC000013980314,3,prod_cat -5,Country-1,reallocate phones hello please kind log each assets attached reallocated these tickets assigned colleagues take care physically removing assets area thank best regards leader,Low,4-Minor,Incident_Type-2,Phone,Target-7
INC000013886454,4,prod_cat -1,Country-1,registration issue hello having trouble while working app report modal receive warning error create card date date print screen attached steps lead problem report modal completed selected format selected date save close deleted wednesday help issue thank,Low,4-Minor,Incident_Type-2,Phone,Target-7
INC000013977900,3,prod_cat -2,Country-1,reaching out hello received unusual wonder safe trap thank friday reaching out good evening appreciate solution wanted interested further exploring effectively leveraging work re resource around best practices well share how other companies industry solution teams help call learn more thank wonderful evening avenue redwood ca,Low,4-Minor,Incident_Type-2,Phone,Target-7
INC000013898905,5,prod_cat -1,Country-1,contracts extensions dear please advised interns move permanent contract february contract extensions after finished internship after finished internship after finished internship after finished internship vatic after finished internship after finished internship after finished internship after finished internship after finished internship after finished internship after finished internship kind regards,Low,4-Minor,Incident_Type-2,Phone,Target-7
INC000013898907,5,prod_cat -3,Country-1,hi please provide working seed training repository thank senior tester,Low,4-Minor,Incident_Type-2,Phone,Target-7
INC000013953013,6,prod_cat -5,Country-1,annual leave wrong records hi has reported wrong calculation her annual leave annual leave december has showed more than supposed absence records kindly assign best regards engineer,Medium,4-Minor,Incident_Type-2,Phone,Target-7
INC000013948153,5,prod_cat -1,Country-1,re contract due thanks please copy signed covers period please update databases accordingly thanks kind regards mobility officer re contract due hi contract extension thanks alerts wrote dear contract due please contract extended date note by disabled contract ended thank,Low,4-Minor,Incident_Type-1,Phone,Target-7
INC000013947324,5,prod_cat -4,Country-1,hi please attached thank,Low,4-Minor,Incident_Type-2,Phone,Target-7
INC000013900797,6,prod_cat -3,Country-1,hello please write required thank,Low,4-Minor,Incident_Type-1,Phone,Target-7
INC000013929962,3,prod_cat -2,Country-1,increasing limit size hi limit increased because nature role numerous requests gets hard keep top kind regards planning officer infrastructure upcoming holiday friday february please consider environment print,Low,4-Minor,Incident_Type-2,Phone,Target-7
INC000013941772,4,prod_cat -1,Country-1,"As of January 5th, it shows there are over 100 voicemails in the mailbox and that it is full but it is also not allowing her to delete any of them because there are actually 0 voicemails in the mailbox. 

+1 (415) 667-0728

Advising to restart phone.",Low,4-Minor,Incident_Type-1,Phone,Target-7
